{"$schema":"https://json-schema.org/draft/2020-12/schema","type":"object","additionalProperties":false,"required":["schema_version","document_type","status","parent_v5_policy_sha256","g1_gate_sha256","patch_v2_sha256","phases","limits","contracts","safety","next_allowed_stage"],"properties":{"schema_version":{"const":"smpcc-r8-liquid-motion-gauge-gpu-build-execution-policy-v6"},"document_type":{"const":"SMPCC_R8_LIQUID_MOTION_GAUGE_GPU_BUILD_EXECUTION_POLICY_V6"},"status":{"const":"REAL_PATCH_AND_STATIC_AUDIT_BOUND_DEFAULT_DENY"},"parent_v5_policy_sha256":{"$ref":"#/$defs/sha"},"g1_gate_sha256":{"$ref":"#/$defs/sha"},"patch_v2_sha256":{"$ref":"#/$defs/sha"},"phases":{"const":["source-copy","patch","wrapper","build","static-audit"]},"limits":{"$ref":"#/$defs/limits"},"contracts":{"$ref":"#/$defs/contracts"},"safety":{"$ref":"#/$defs/safety"},"next_allowed_stage":{"const":"EXACT_V6_USER_AUTHORIZATION_REQUIRED"}},"$defs":{"sha":{"type":"string","pattern":"^[0-9a-f]{64}$"},"limits":{"type":"object","additionalProperties":false,"required":["parallel_jobs","wall_seconds","cpu_seconds","address_space_bytes","minimum_memavailable_bytes","monitor_seconds","static_output_per_command_bytes","static_output_total_bytes"],"properties":{"parallel_jobs":{"const":1},"wall_seconds":{"const":5400},"cpu_seconds":{"const":5400},"address_space_bytes":{"const":8589934592},"minimum_memavailable_bytes":{"const":4294967296},"monitor_seconds":{"const":20},"static_output_per_command_bytes":{"const":268435456},"static_output_total_bytes":{"const":268435456}}},"contracts":{"type":"object","additionalProperties":false,"required":["sealed_entries","patch_files","wrapper_bytes","objects","static_commands","candidate_mode"],"properties":{"sealed_entries":{"const":352},"patch_files":{"const":6},"wrapper_bytes":{"const":84},"objects":{"const":131},"static_commands":{"const":557},"candidate_mode":{"const":"0400"}}},"safety":{"type":"object","additionalProperties":false,"required":["default_deny","o_excl_nofollow_fsync","fd_patch_replace","one_make","candidate_never_executes","gpu_network_forbidden","static_identity_before_after","finally_unload_zero_residue"],"properties":{"default_deny":{"const":true},"o_excl_nofollow_fsync":{"const":true},"fd_patch_replace":{"const":true},"one_make":{"const":true},"candidate_never_executes":{"const":true},"gpu_network_forbidden":{"const":true},"static_identity_before_after":{"const":true},"finally_unload_zero_residue":{"const":true}}}}}
