{"schema_version":"smpcc-r8-liquid-motion-gauge-gpu-build-execution-policy-v6","document_type":"SMPCC_R8_LIQUID_MOTION_GAUGE_GPU_BUILD_EXECUTION_POLICY_V6","status":"REAL_PATCH_AND_STATIC_AUDIT_BOUND_DEFAULT_DENY","parent_v5_policy_sha256":"d05fb023fab7bb29ca7d7c453dd0aa4dc5cab3dbf20195e1641f43638fa33337","g1_gate_sha256":"e34ab0facc3c665c6befbb792c7344e0af6e652fd3c6b30dfa81ca8cbea5b502","patch_v2_sha256":"1bac7e958e2c15db3c2d45638496c23a780c4b455447e90616bafb9ad50eb835","phases":["source-copy","patch","wrapper","build","static-audit"],"limits":{"parallel_jobs":1,"wall_seconds":5400,"cpu_seconds":5400,"address_space_bytes":8589934592,"minimum_memavailable_bytes":4294967296,"monitor_seconds":20,"static_output_per_command_bytes":268435456,"static_output_total_bytes":268435456},"contracts":{"sealed_entries":352,"patch_files":6,"wrapper_bytes":84,"objects":131,"static_commands":557,"candidate_mode":"0400"},"safety":{"default_deny":true,"o_excl_nofollow_fsync":true,"fd_patch_replace":true,"one_make":true,"candidate_never_executes":true,"gpu_network_forbidden":true,"static_identity_before_after":true,"finally_unload_zero_residue":true},"next_allowed_stage":"EXACT_V6_USER_AUTHORIZATION_REQUIRED"}
